<?xml version="1.0" encoding="UTF-8"?>
<persons xmlns="http://www.SAA.com/passportControl/persons"
  xmlns:xsi="http://www.w3.org/2001/XMLSchema-instance"
  xsi:schemaLocation="http://www.SAA.com/passportControl/persons 
              persons.xsd">
  <person>
    <name>Piet Pompies</name>
    <passport>
      <country>South Africa</country>
      <passportNumber>RSA9873288763</passportNumber>
    </passport>
  </person>
  <person>
    <name>Tandi Mkondo</name>
    <passport>
      <country>South Africa</country>
      <passportNumber>RSA53278632876</passportNumber>
    </passport>
  </person>
  <employee permanent="true">
    <name>Marie Curie</name>
    <passport>
      <country>France</country>
      <passportNumber>FR7653276532765</passportNumber>
    </passport>
    <employer>University of X</employer>
    <salary>0</salary>
  </employee>
  
</persons>
